{
  "id": "wolf",
  "name": "Wolf",
  "description": "A lean, gray-furred predator with sharp instincts. Wolves hunt in packs and are territorial. They rarely attack well-armed travelers unless hungry or provoked.",
  "category": "beast",
  "race": "canine",
  "size": "medium",
  "defaultBehavior": "pack_predator",
  "asciiChar": "w",
  "foregroundColor": "#808080",
  "backgroundColor": "#000000",
  "baseStats": {
    "str": 12,
    "dex": 16,
    "con": 14,
    "int": 3,
    "wis": 12,
    "cha": 6,
    "max_hp": 24,
    "max_stamina": 30
  },
  "abilities": ["bite", "pack_tactics", "keen_smell"],
  "naturalDrops": ["wolf_pelt", "wolf_meat", "wolf_fang"],
  "factionId": "wildlife",
  "properties": {
    "pack_size": "4-8",
    "territory_radius": "5_chunks",
    "active_time": "crepuscular"
  }
}
